{
  "event_id": "EVT-AAPL-FY26Q3-ERN",
  "label_id": "EVT-AAPL-FY26Q3-ERN-LBL-01",
  "protocol_version": "0.1",
  "layer_a_artifact_hashes": [
    {
      "artifact_path": "dossier_narrative_v1.md",
      "sha256": "aaaaaaaaaaaaaaaaaaaaaaaaaaaaaaaaaaaaaaaaaaaaaaaaaaaaaaaaaaaaaaaa"
    }
  ],
  "freeze_timestamp_utc": "2026-08-02T10:00:00+00:00",
  "frozen_by": "jane.reviewer",
  "reviewer_capture_exposure_log": [],
  "reveal_events": []
}