{
  "event_id": "EVT-AAPL-FY26Q3-ERN",
  "label_id": "EVT-AAPL-FY26Q3-ERN-LBL-01",
  "protocol_version": "0.1",
  "layer_a_artifact_hashes": [
    {
      "artifact_path": "frozen/EVT-AAPL-FY26Q3-ERN/EVT-AAPL-FY26Q3-ERN-LBL-01/claim_sources.csv",
      "sha256": "498717192f25fcda549adc5edcc2b0578c4252ded3ab6b7e37b31f893dbae271"
    },
    {
      "artifact_path": "frozen/EVT-AAPL-FY26Q3-ERN/EVT-AAPL-FY26Q3-ERN-LBL-01/claims.csv",
      "sha256": "da2bca237dc161e5c090d4ae637416adba33bdc665f1361ce5dec9a6a7de5d8e"
    },
    {
      "artifact_path": "frozen/EVT-AAPL-FY26Q3-ERN/EVT-AAPL-FY26Q3-ERN-LBL-01/event_label.csv",
      "sha256": "4822218fe938e5183168bbb2f32438d99e356d64b68a3e2efdb67af2cda007cd"
    },
    {
      "artifact_path": "frozen/EVT-AAPL-FY26Q3-ERN/EVT-AAPL-FY26Q3-ERN-LBL-01/event_label_capex_effects.csv",
      "sha256": "c9794959c9e3e51ee14df676ff93b87bc4c4a69a96adce8276e1647e2f8e2919"
    },
    {
      "artifact_path": "frozen/EVT-AAPL-FY26Q3-ERN/EVT-AAPL-FY26Q3-ERN-LBL-01/event_label_cross_company_implications.csv",
      "sha256": "9ad898fd0d3b3001f208fbf84d1404a2c445ad5c05b39614766c8e910aab58d1"
    },
    {
      "artifact_path": "frozen/EVT-AAPL-FY26Q3-ERN/EVT-AAPL-FY26Q3-ERN-LBL-01/events.csv",
      "sha256": "0044b86c81d99833a1c369ec0031772484c0f342588f3057208c9e314e012294"
    },
    {
      "artifact_path": "frozen/EVT-AAPL-FY26Q3-ERN/EVT-AAPL-FY26Q3-ERN-LBL-01/management_qna.csv",
      "sha256": "274dc2215585b51948ff4f553a56b0b22554d21ace24c5a21371423eb0b5f8df"
    }
  ],
  "freeze_timestamp_utc": "2026-08-02T10:00:00+00:00",
  "frozen_by": "jane.reviewer",
  "reviewer_capture_exposure_log": [],
  "reveal_events": [
    {
      "layer": "B_market_response",
      "revealed_at_utc": "2026-08-02T10:00:00+00:00",
      "revealed_by": "jane.reviewer"
    }
  ]
}