{
  "event_id": "EVT-AAPL-FY26Q3-ERN",
  "label_id": "EVT-AAPL-FY26Q3-ERN-LBL-01",
  "protocol_version": "0.1",
  "layer_a_artifact_hashes": [
    {
      "artifact_path": "frozen/EVT-AAPL-FY26Q3-ERN/EVT-AAPL-FY26Q3-ERN-LBL-01/claim_sources.csv",
      "sha256": "89e7afd192a2cca0d2e0f4a46b129a3ac2a8b4f834c68e20da1abf37bb89af91"
    },
    {
      "artifact_path": "frozen/EVT-AAPL-FY26Q3-ERN/EVT-AAPL-FY26Q3-ERN-LBL-01/claims.csv",
      "sha256": "4ec1652dfee1175c5d2ba238fee613d6d7742651c3df3c74791944f4733ad066"
    },
    {
      "artifact_path": "frozen/EVT-AAPL-FY26Q3-ERN/EVT-AAPL-FY26Q3-ERN-LBL-01/event_label.csv",
      "sha256": "9f0129ea76b976b619d6fad1f4d81df6f907234c1599ade6349fd253875ad592"
    },
    {
      "artifact_path": "frozen/EVT-AAPL-FY26Q3-ERN/EVT-AAPL-FY26Q3-ERN-LBL-01/event_label_capex_effects.csv",
      "sha256": "f1efd479c71da855c8127b27fe0b330e9554c9f802483e8d715d5ba3647ab99d"
    },
    {
      "artifact_path": "frozen/EVT-AAPL-FY26Q3-ERN/EVT-AAPL-FY26Q3-ERN-LBL-01/event_label_cross_company_implications.csv",
      "sha256": "5bcf5ed8c6a44280046113c7bbe646c7d723e8b621f6fe12e150c61ff6073ef9"
    },
    {
      "artifact_path": "frozen/EVT-AAPL-FY26Q3-ERN/EVT-AAPL-FY26Q3-ERN-LBL-01/events.csv",
      "sha256": "3cf6c28a75054db13caafb981590a6bb5506166f1fcb3feda0eca006936e32fa"
    },
    {
      "artifact_path": "frozen/EVT-AAPL-FY26Q3-ERN/EVT-AAPL-FY26Q3-ERN-LBL-01/management_qna.csv",
      "sha256": "7b2d2d7e09302d2deacffd3336b9bd7c2b2aa6ed87dc3bcb84223a3e96654d9d"
    }
  ],
  "freeze_timestamp_utc": "2026-08-02T10:00:00+00:00",
  "frozen_by": "jane.reviewer",
  "reviewer_capture_exposure_log": [],
  "reveal_events": []
}